{
  "schema_version": 1,
  "ticker": "NWL",
  "period": "2023-FY",
  "generated_from": {
    "signals": "data/signals/NWL/2023-FY.json",
    "risks": "data/risks/NWL/2023-FY.json"
  },
  "input_completeness": {
    "company_type": "standard_corporate",
    "sector_module": "generic",
    "required_metrics": {
      "applicable": 6,
      "available": 6,
      "missing": 0,
      "missing_ids": [],
      "completeness_pct": 100.0
    },
    "optional_metrics": {
      "applicable": 1,
      "available": 1,
      "missing": 0,
      "missing_ids": [],
      "completeness_pct": 100.0
    },
    "provenance": {
      "applicable": 7,
      "available": 7,
      "missing": 0,
      "completeness_pct": 100.0
    }
  },
  "summaries": {
    "profitability_summary": {
      "status": "insufficient_data",
      "positive_signals": [],
      "negative_signals": [],
      "neutral_signals": [],
      "unavailable_signals": [
        "revenue_growth_trend",
        "operating_profit_before_investment_trend",
        "operating_profit_including_investments_trend",
        "net_profit_trend",
        "gross_margin_trend",
        "operating_margin_trend",
        "net_margin_trend"
      ],
      "missing_signals": [],
      "key_drivers": [],
      "completeness": {
        "section_signals": {
          "applicable": 7,
          "available": 0,
          "unavailable": 7,
          "missing": 0,
          "completeness_pct": 0.0
        }
      },
      "data_completeness": 0.0,
      "investment_signal": false
    },
    "cash_flow_summary": {
      "status": "insufficient_data",
      "positive_signals": [],
      "negative_signals": [],
      "neutral_signals": [],
      "unavailable_signals": [
        "operating_cash_flow_trend",
        "free_cash_flow_trend",
        "cash_conversion_trend",
        "deferred_revenue_trend"
      ],
      "missing_signals": [],
      "key_drivers": [],
      "completeness": {
        "section_signals": {
          "applicable": 4,
          "available": 0,
          "unavailable": 4,
          "missing": 0,
          "completeness_pct": 0.0
        }
      },
      "data_completeness": 0.0,
      "investment_signal": false
    },
    "balance_sheet_summary": {
      "status": "insufficient_data",
      "positive_signals": [],
      "negative_signals": [],
      "neutral_signals": [],
      "unavailable_signals": [
        "deferred_revenue_trend",
        "lease_burden_trend",
        "leverage_trend"
      ],
      "missing_signals": [],
      "key_drivers": [],
      "completeness": {
        "section_signals": {
          "applicable": 3,
          "available": 0,
          "unavailable": 3,
          "missing": 0,
          "completeness_pct": 0.0
        }
      },
      "data_completeness": 0.0,
      "investment_signal": false
    },
    "liquidity_summary": {
      "status": "insufficient_data",
      "positive_signals": [],
      "negative_signals": [],
      "neutral_signals": [],
      "unavailable_signals": [
        "liquidity_trend"
      ],
      "missing_signals": [],
      "key_drivers": [],
      "completeness": {
        "section_signals": {
          "applicable": 1,
          "available": 0,
          "unavailable": 1,
          "missing": 0,
          "completeness_pct": 0.0
        }
      },
      "data_completeness": 0.0,
      "investment_signal": false
    },
    "leverage_summary": {
      "status": "insufficient_data",
      "positive_signals": [],
      "negative_signals": [],
      "neutral_signals": [],
      "unavailable_signals": [
        "leverage_trend",
        "lease_burden_trend"
      ],
      "missing_signals": [],
      "key_drivers": [],
      "completeness": {
        "section_signals": {
          "applicable": 2,
          "available": 0,
          "unavailable": 2,
          "missing": 0,
          "completeness_pct": 0.0
        }
      },
      "data_completeness": 0.0,
      "investment_signal": false
    },
    "risk_summary": {
      "status": "insufficient_data",
      "positive_signals": [],
      "negative_signals": [],
      "neutral_signals": [],
      "unavailable_signals": [],
      "missing_signals": [],
      "key_risks": [],
      "completeness": {
        "section_signals": {
          "applicable": 0,
          "available": 0,
          "unavailable": 0,
          "missing": 0,
          "completeness_pct": 100.0
        }
      },
      "data_completeness": 100.0,
      "investment_signal": false
    },
    "company_fundamentals_summary": {
      "status": "insufficient_data",
      "positive_signals": [],
      "negative_signals": [],
      "neutral_signals": [],
      "unavailable_signals": [
        "revenue_growth_trend",
        "operating_profit_before_investment_trend",
        "operating_profit_including_investments_trend",
        "net_profit_trend",
        "operating_cash_flow_trend",
        "free_cash_flow_trend",
        "gross_margin_trend",
        "operating_margin_trend",
        "net_margin_trend",
        "cash_conversion_trend",
        "liquidity_trend",
        "leverage_trend",
        "lease_burden_trend",
        "deferred_revenue_trend"
      ],
      "missing_signals": [],
      "key_drivers": [],
      "completeness": {
        "section_signals": {
          "applicable": 14,
          "available": 0,
          "unavailable": 14,
          "missing": 0,
          "completeness_pct": 0.0
        }
      },
      "data_completeness": 0.0,
      "investment_signal": false
    }
  }
}
