{
  "schema_version": 1,
  "ticker": "WMT",
  "period": "2026-FY",
  "generated_from": {
    "signals": "data/signals/WMT/2026-FY.json",
    "risks": "data/risks/WMT/2026-FY.json"
  },
  "input_completeness": {
    "company_type": "standard_corporate",
    "sector_module": "generic",
    "required_metrics": {
      "applicable": 6,
      "available": 6,
      "missing": 0,
      "missing_ids": [],
      "completeness_pct": 100.0
    },
    "optional_metrics": {
      "applicable": 1,
      "available": 1,
      "missing": 0,
      "missing_ids": [],
      "completeness_pct": 100.0
    },
    "provenance": {
      "applicable": 5,
      "available": 5,
      "missing": 0,
      "completeness_pct": 100.0
    }
  },
  "summaries": {
    "profitability_summary": {
      "status": "mixed",
      "positive_signals": [
        "net_profit_trend"
      ],
      "negative_signals": [],
      "neutral_signals": [
        "revenue_growth_trend",
        "operating_profit_before_investment_trend",
        "operating_profit_including_investments_trend",
        "gross_margin_trend",
        "operating_margin_trend",
        "net_margin_trend"
      ],
      "unavailable_signals": [],
      "missing_signals": [],
      "key_drivers": [
        "Değer yıllık bazda +%10,5 artmıştır (büyüme kuralı v1: ≥ %5 pozitif eşiğinin üzerinde)."
      ],
      "completeness": {
        "section_signals": {
          "applicable": 7,
          "available": 7,
          "unavailable": 0,
          "missing": 0,
          "completeness_pct": 100.0
        }
      },
      "data_completeness": 100.0,
      "investment_signal": false
    },
    "cash_flow_summary": {
      "status": "positive",
      "positive_signals": [
        "operating_cash_flow_trend",
        "free_cash_flow_trend"
      ],
      "negative_signals": [],
      "neutral_signals": [
        "cash_conversion_trend"
      ],
      "unavailable_signals": [
        "deferred_revenue_trend"
      ],
      "missing_signals": [],
      "key_drivers": [
        "Değer yıllık bazda +%14,1 artmıştır (büyüme kuralı v1: ≥ %5 pozitif eşiğinin üzerinde).",
        "Değer yıllık bazda +%17,9 artmıştır (büyüme kuralı v1: ≥ %5 pozitif eşiğinin üzerinde)."
      ],
      "completeness": {
        "section_signals": {
          "applicable": 4,
          "available": 3,
          "unavailable": 1,
          "missing": 0,
          "completeness_pct": 75.0
        }
      },
      "data_completeness": 75.0,
      "investment_signal": false
    },
    "balance_sheet_summary": {
      "status": "mixed",
      "positive_signals": [],
      "negative_signals": [
        "lease_burden_trend"
      ],
      "neutral_signals": [
        "leverage_trend"
      ],
      "unavailable_signals": [
        "deferred_revenue_trend"
      ],
      "missing_signals": [],
      "key_drivers": [
        "Kira yükümlülüğü büyümesi (+%8,7) ve kira ödemeleri büyümesi (mevcut değil) birlikte değerlendirilmiştir."
      ],
      "completeness": {
        "section_signals": {
          "applicable": 3,
          "available": 2,
          "unavailable": 1,
          "missing": 0,
          "completeness_pct": 66.7
        }
      },
      "data_completeness": 66.7,
      "investment_signal": false
    },
    "liquidity_summary": {
      "status": "insufficient_data",
      "positive_signals": [],
      "negative_signals": [],
      "neutral_signals": [],
      "unavailable_signals": [
        "liquidity_trend"
      ],
      "missing_signals": [],
      "key_drivers": [],
      "completeness": {
        "section_signals": {
          "applicable": 1,
          "available": 0,
          "unavailable": 1,
          "missing": 0,
          "completeness_pct": 0.0
        }
      },
      "data_completeness": 0.0,
      "investment_signal": false
    },
    "leverage_summary": {
      "status": "mixed",
      "positive_signals": [],
      "negative_signals": [
        "lease_burden_trend"
      ],
      "neutral_signals": [
        "leverage_trend"
      ],
      "unavailable_signals": [],
      "missing_signals": [],
      "key_drivers": [
        "Kira yükümlülüğü büyümesi (+%8,7) ve kira ödemeleri büyümesi (mevcut değil) birlikte değerlendirilmiştir."
      ],
      "completeness": {
        "section_signals": {
          "applicable": 2,
          "available": 2,
          "unavailable": 0,
          "missing": 0,
          "completeness_pct": 100.0
        }
      },
      "data_completeness": 100.0,
      "investment_signal": false
    },
    "risk_summary": {
      "status": "insufficient_data",
      "positive_signals": [],
      "negative_signals": [],
      "neutral_signals": [],
      "unavailable_signals": [],
      "missing_signals": [],
      "key_risks": [],
      "completeness": {
        "section_signals": {
          "applicable": 0,
          "available": 0,
          "unavailable": 0,
          "missing": 0,
          "completeness_pct": 100.0
        }
      },
      "data_completeness": 100.0,
      "investment_signal": false
    },
    "company_fundamentals_summary": {
      "status": "mixed",
      "positive_signals": [
        "net_profit_trend",
        "operating_cash_flow_trend",
        "free_cash_flow_trend"
      ],
      "negative_signals": [
        "lease_burden_trend"
      ],
      "neutral_signals": [
        "revenue_growth_trend",
        "operating_profit_before_investment_trend",
        "operating_profit_including_investments_trend",
        "gross_margin_trend",
        "operating_margin_trend",
        "net_margin_trend",
        "cash_conversion_trend",
        "leverage_trend"
      ],
      "unavailable_signals": [
        "liquidity_trend",
        "deferred_revenue_trend"
      ],
      "missing_signals": [],
      "key_drivers": [
        "Değer yıllık bazda +%10,5 artmıştır (büyüme kuralı v1: ≥ %5 pozitif eşiğinin üzerinde).",
        "Değer yıllık bazda +%14,1 artmıştır (büyüme kuralı v1: ≥ %5 pozitif eşiğinin üzerinde).",
        "Kira yükümlülüğü büyümesi (+%8,7) ve kira ödemeleri büyümesi (mevcut değil) birlikte değerlendirilmiştir."
      ],
      "completeness": {
        "section_signals": {
          "applicable": 14,
          "available": 12,
          "unavailable": 2,
          "missing": 0,
          "completeness_pct": 85.7
        }
      },
      "data_completeness": 85.7,
      "investment_signal": false
    }
  }
}
